,Posição,Endereço,Área,Quartos,Banheiros,Vagas,Condomínio,IPTU,Descrição,Status,Página,Preço
438,7,"Estrada da Paciência, Cosmos",,,,,290,,Condomínio Rio vida Palmares próximo à Estrada do Campinho Possui piscina salão de festa playground churrasqueira e portaria 24 horas O apartamento possui dois quartos cozinha b,Comum,1,38000
439,8,"Rua Sorocaba, Botafogo",,,,,1630,3510,Assista ao vídeo tour deste imóvel clicando na foto e na opção VIDEO Ultima Atualização 03 06 rioavenda com traz ao mercado lindo apartamento 3 quartos sendo 1 suíte disposto,Destaque,1,
440,9,"Avenida Salvador Allende, Barra da Tijuca",,,,,,,Novo lançamento na Avenida Salvador Allende ao lado do Condomínio Ilha Pura na Barra da Tijuca será construído em uma das áreas mais bonitas da região e os futuros moradores irão,Comum,1,
441,10,"Rua César do Rego Monteiro Filho, Engenho Da Rainha",,,,,,,Apartamento Tomás Coelho Ocupado contendo 2 dormitório s 1 banheiro s 0 01 M² de área de terreno 50 00 M² de área privativa Matrícula nº 81 921 6 Inscrição Prefeitura 13,Comum,1,50097
442,11,"Estrada Coronel Pedro Corrêa, Jacarepaguá",,,,,,,O apartamento no bairro Jacarepaguá tem 64 metros quadrados com 2 quartos e 1 banheiro Está cercado de todas as facilidades numa região pronta para atender com excelência um públi,Destaque,1,549000
443,12,"Rua Tácito Esmeris, Bento Ribeiro",,,,,,,Apartamento Bento Ribeiro Ocupado contendo 1 dormitório s 1 banheiro s 52 00 M² de área privativa Matrícula nº 10185 8º Ofício de Imóvel do Rio de Janeiro RJ Valor avalia,Comum,1,76648
444,13,"Rua Doutor Bernardino, Praça Seca",,,,,,,Ótimo apartamento 2 quartos 2 banheiros bem arejado com varanda interna jardim de inverno em rua tranquila na Praça Seca,Comum,1,150000
445,14,"Rua da Assembléia, Centro",,,,,1300,230,Sala comercial no edifício Cândido Mendes na Rua da Assembleia 10 decimo sexto andar com vista deslumbrante da Baía de Guanabara sala com 42 metros quadrados com ar condicionado,Destaque,1,300000
446,15,"Estrada Capenha, Pechincha",,,,,520,580,RSantos imobiliária vende Apartamento em condomínio novo no Pechincha Composto de sala em 2 ambientes varanda 2 quartos sendo 1 suíte 1 banheiro social cozinha com área de s,Destaque,1,305000
447,16,"Campinho, Rio de Janeiro",,,,,,,Campinho Melodia Residencial primeira locação Pronto para morar Apartamento de 2 quartos suite sala dois ambientes varanda cozinha área de serviço vaga de garagem Coz,Comum,1,324800
448,17,"Rua São Brás, Todos os Santos",,,,,20,20,Aproveite esse Oportunidade Entrada Facilitada Entrada dividida em até 3x Aceitamos Carro como entrada Aceitamos seu FGTS O Norte Premium é a escolha certa para quem quer uma,Comum,1,
449,18,"Campo Grande, Rio de Janeiro",,,,,,,BEM GRANDES POUCOS E PRIVILEGIADOS PROMOÇÕES DE TERRENOS EM CAMPO GRANDE MENDANHA 9x20 180M² 9x22 198M² 12x22 264M² 100 planos e prontos DE 50 000 ATÉ 68 000 preços,Comum,1,58000
450,19,"Estrada do Engenho D'Agua, Jacarepaguá",,,,,20,20,Up Barra Mais Condomínio Club pronto e perfeito para morar e não se preocupar com nada O Up Barra oferece apartamentos de 2 e 3 de quartos a partir de 54 m² a 70 m² com suíte al,Comum,1,400000
451,20,"Rua Maranhão, Méier",,,,,450,,Real UP Vende Apartamento com 47 metros quadrados com 1 quarto com sacada e armário embutido 1 banheiro social dependencia de empregada com banheiro bem iluminado ventilado c,Comum,1,250000
452,21,"Campo Grande, Rio de Janeiro",,,,,,,GRANDÕES POUCOS E PRIVILEGIADOS PROMOÇÕES DE TERRENOS EM CAMPO GRANDE MENDANHA 9x20 180M² 9x22 198M² 12x22 264M² 100 planos e prontos DE 50 000 ATÉ 68 000 preços fi,Comum,1,58000
453,22,"Travessa Padre Damião, Tijuca",,,,,513,,TIJUCA PRÓXIMO A PRAÇA SAENS PENA EXCELENTE LOCALIZAÇÃO CONSULTÓRIO COMPOSTO DE SALA DE RECEPÇÃO SALA CONSULTÓRIO COPA COZINHA E BANHEIRO TOTALMENTE REFORMADA Cód TJSL0005,Comum,1,150000
454,23,"Taquara, Rio de Janeiro",,,,,550,450,Mais sobre o Apartamento na Rua Macembu No coração da Taquara Excelente imóvel com armários confortável silencioso e arejado Lugar arborizado com espaço muito aprazível e a,Comum,1,315000
455,24,"Avenida Meriti, Vila Kosmos",,,,,240,514,Aconchegante apartamento na principal Avenida da Vila Kosmos a minutos do Shopping Carioca Vaga marcada na garagem sol da manhã e dependências de empregada Convido você e sua f,Comum,1,230000
456,1,"Rua Princesa Isabel, Cidade Alta",,,,,,,O melhor prédio da Cidade Alta entre Tirol e Petrópolis PRONTO PARA MORAR 3 Quartos sendo 1 Suíte 3 Banheiros 1 Suíte 1 Social e 1 de Serviço Empreendimento com habite se,Pronto para morar,1,340000
457,2,"Avenida Moema Tinoco da Cunha Lima, Pajuçara",,,,,,,Piso Laminado no Quarto Piso Laminado na Sala Lazer equipado Previsão para medição de água individualizada Preparação para Wi fi nas áreas de lazer Portas Especiais Pomar Co,Em construção,1,151490
458,3,"Rua José Pegado Mendes, Jardim Lola",,,,,,,Cidade Arvoredo bairro planejado em São Gonçalo do Amarante Casas prontas para morar de 2 quartos com parcelas a partir de R 359 00 por mês Sua chance de morar bem e com qualida,Pronto para morar,1,79900
459,4,"Rua Luiz Estevam, Ponta Negra",,,,,450000,450000,O apartamento está localizado no bairro Ponta Negra com 70 metros quadrados com 3 quartos sendo 1 suíte e 2 banheiros Excelente Residencial Ondas do Mar em Ponta Negra Vista para,Super destaque,1,450000
460,5,"Avenida Deodoro da Fonseca, Ribeira",,,,,,,Uma ótima oportunidade de negócios para você Um excelente ponto localizado quase em frente a 96 FM de esquina na Avenida Deodoro da Fonseca com a Rua Dr Manoel Dantas te dá,Super destaque,1,600000
461,6,"Rua Vereador Manoel Sátiro, Ponta Negra",,,,,,,O apartamento no bairro Ponta Negra Natal RN possui 55 metros quadrados com 2 quartos sendo 1 suite e 2 banheiros com vista para o mar todo reformado e mobiliado pronta para vc m,Super destaque,1,320000
462,7,"Praia do Meio, Natal",,,,,,,A casa possui 156 metros quadrados com 3 quartos sendo 1 suite e 2 banheiros,Comum,1,40000
463,8,"Rua Tenente Olavo Francisco dos Santos, Ponta Negra",,,,,660,2900,Lindo apartamento com 115m disponível para locação no Residencial Club luau de Ponta Negra Com 3 quartos seno 1 suíte e dois semi suítes Dependência completa com banheiro Ban,Destaque,1,700000
464,9,"Rua Eletricista João Trajano da Silva, Nossa Senhora de Nazaré",,,,,,,ende se Apart No Ed avenida lima e Silva 1725 Edifício Carmel 317mil em lagoa nova Ótima localização Área construída 54m2 Condomínio 380 00 IPTU 1370 2 4 2 banhei,Destaque,1,317000
465,10,"Avenida Hermes da Fonseca, Tirol",,,,,,,A casa está localizado no Tirol com 120 metros quadrados com 3 quartos sendo 1 suite e 2 banheiros,Comum,1,20000
466,11,"Avenida Capitão-mor Gouveia, Lagoa Nova",,,,,,2200,OPORTUNIDADE Casa em Natal com uma localização privilegiadíssima entre duas avenidas muito importantes Av Capitão Mor Gouveia e Av São José próximo ao estádio Arena Das Duna,Comum,1,513000
467,12,"Rua Affonso Rique, Pajuçara",,,,,,,A casa está localizado na ponta negra com 120 metros quadrados com 3 quartos sendo 1 suite e 2 banheiros,Comum,1,25000
468,13,"Rua dos Pintassilgos, Pitimbu",,,,,,,O apartamento no bairro Pitimbu tem 55 metros quadrados com 2 quartos sendo 1 suite e 2 banheiros Possui academia espaço gourmet jardim área de brinquedo para as crianças salão,Comum,1,215000
469,14,"Tirol, Natal",,,,,550,,Excelente apartamento localizado no coração do Tirol todo novinho com 98 m2 de área privativa 3 quartos sendo 1 suíte 2 banheiros sala para 2 ambientes varanda gourmet depen,Destaque,1,560000
470,15,"Rua Aderbal de França, Candelária",,,,,,,Disponibilizo para venda belíssima casa na melhor localidade do bairro tradicional potiguar Candelária Localizada próximo ao Fórum Judicial Miguel Seabra Fagundes a 10 min dos pr,Comum,1,329000
471,16,"Pitimbu, Natal",,,,,,,Vende se casa em Cidade Satélite perto da estação de trem do Planalto próximo de tudo parada de ônibus mercados padarias farmácias colégios UPA postos de saúde etc O imó,Comum,1,165000
472,17,"Avenida Abreu e Lima, Pitimbu",,,,,,,A casa está localizado no Pitimbu possui 120 metros quadrados com 3 quartos sendo 1 suite e 2 banheiros,Comum,1,20000
473,18,"Rua Andrelândia, Neópolis",,,,,,,Casa localizado no bairro Neópolis próximo a padaria Ki pão Premium farmácias restaurantes e lanchonetes Imóvel com terreno 12x25 sendo 180 metros construído Garagem para 03,Comum,1,
474,19,"Rua Romualdo Galvão, Lagoa Nova",,,,,1,1,Apartamento pronto em Lagoa Nova Sombra 60m² Dois quartos sendo um suíte Varanda Wc social R 250 000 00 somente à vista Área de lazer completa 3 salões para,Destaque,1,249000
475,20,"Rua Marcos Augusto Teixeira de Carvalho Filho, Planalto",,,,,265,1284,Planalto Dream Residencial A oportunidade que você estava esperando O Planalto Dream é um condomínio completo com tudo que você sempre sonhou para sua família ao alcance do seu,Comum,1,140000
476,21,"Rua São Leopoldo, Cidade da Esperança",,,,,,800,Vendemos casa com 3 quartos no bairro de cidade da esperança Com construçao averbada podendo ser financiada Terreno 200m2 Área Construída 187m2 Sala para 2 ambientes 3,Comum,1,265000
477,22,"Rua Altaneira, Potengi",,,,,,,Casa no conjunto santa catarina com 03 quartos sendo 01 suíte banheiro social cozinha ampla em L sala muito espaçosa com possibilidade de criar outro ambiente Proximidades do F,Comum,1,
478,23,"Alameda Professora Angélica de Almeida Moura, Neópolis",,,,,,,Linda casa reformada com 3 quartos sendo 2 suítes 2 salas 1 banheiro social 1 cozinha com armários 1 área de serviço 1 Dependência de empregada grande 1 Quintal 1 Garagem c,Comum,1,330000
479,24,"Rua Teofilândia, Neópolis",,,,,,,Espaçosa e ventilada são os destaques dessa casa que fica localizada no bairro de Neópolis próxima a padaria Sabor de Pão na avenida Ayrton Senna A casa com 200m² reformada e mo,Comum,1,385000
480,1,"Rua Miguel Tostes, Rio Branco",,,,,,,Localizado numa das ruas mais queridas da região a Miguel Tostes o empreendimento foi pensado para quem busca a experiência de viver dentro e fora de casa o estilo de vida que,Em construção,1,773390
481,2,"Rua Coronel Paulino Teixeira, Rio Branco",,,,,,,suíte e churrasqueira no Rio Branco Idealizado pelo Studio Dror renomado arquiteto reconhecido internacionalmente o The Park possui diversas opções de plantas amplas de 143 a,Em construção,1,1932312
482,3,"Rua Professor Duplan, Rio Branco",,,,,,,Um jeito inteligente e sob medida de viver e pensar a vida onde o centro de tudo é a sua comodidade Não é uma nova forma de viver é o seu jeito de criar novas maneiras de ocupa,Na planta,1,313435
483,4,"Avenida Lageado, Petrópolis",,,,,1241,316,Apartamento à venda no bairro Petrópolis São 120m² de área privativa distribuídos em um living amplo com lareira sacada integrada com churrasqueira cozinha com área e banheiro,Super destaque,1,900000
484,5,"Boa Vista, Porto Alegre",,,,,1450,441,Apartamento cobertura com 3 dormitórios uma suíte Em sua parte inferior esse imóvel possui sala de estar para 02 ambientes com um 2 dormitórios lindo piso em laminado cozinha be,Super destaque,1,
485,6,"Rua General Lima e Silva, Cidade Baixa",,,,,220,,Excelente opção de apartamento no melhor local da Cidade Baixa em Porto Alegre quinto andar com vista permanente ensolarado armário sob medida no dormitórios cozinha com armári,Super destaque,1,200000
486,7,"Rua Orfanotrófio, Alto Teresópolis",,,,,440,50,NBKT NOBILITARE oferta para VENDA Apartamento no bairro Alto Teresópolis em Porto Alegre com 3 dormitório s 1 vaga s de garagem com área privativa de 87 50 m² e área tota,Destaque,1,250000
487,8,"Avenida Assis Brasil, São Sebastião",,,,,300,700,Venda excelente sala comercial em andar alto com 25 17m2 privativos Sala já com piso montada mobiliada e decorada está com móveis divisórias split Localizada em um empreend,Comum,1,298000
488,9,"Passo da Areia, Porto Alegre",,,,,240,,Apartamento 1 dormitório sala cozinha e área de serviço banheiro social estacionamento ótima localização próximo ao Carrefour Nossos corretores estão também disponíveis para,Comum,1,210000
489,10,"Rubem Berta, Porto Alegre",,,,,,,CASA COM 3 DORMITÓRIOS 2 banheiros Com living 02 ambientes banheiro social cozinha pia de inox churrasqueira e ímóvel amplo Próximo à todos os recursos do bairro colégio Jea,Comum,1,125000
490,11,"Rua Dois Mil Novecentos e Noventa e Nove, Mário Quintana",,,,,498,2830,Na parte de baixo tem Escritório Sala estar sala jantar Lavabo cozinha lavanderia garagem coberta para 2 carros espaço para 2 carros sem cobertura área churrasqueira com,Destaque,1,1600000
491,12,"Cavalhada, Porto Alegre",,,,,,,Oportunidade Única Terreno de 10x30 com 3 casas construídas por apenas 350 MIL Terreno de 10x30 com edificação de 3 casas oportunidade para você comprar alugar os imóve,Destaque,1,320000
492,13,"Alto Petrópolis, Porto Alegre",,,,,250,,Terreno no condomínio Verdes Campos em Porto Alegre na Protásio Alves número 1200 de 250m² frente Norte rua tranquila Segurança 24 horas parque lago área verde playground q,Comum,1,200000
493,14,"Glória, Porto Alegre",,,,,,417,Casa Comercial de 0 dormitório s 0 suíte s e 10 vaga s de garagem para VENDA na Coronel Aparicio Borges nº 900 no bairro Glória em Porto Alegre Kotel Imobiliária oferta para,Comum,1,958000
494,15,"Rua Roque Calage, Passo da Areia",,,,,700,900,Apartamento 2 dormitórios sendo 1 suíte living 2 ambientes sacada integrada ao living com churrasqueira banheiro social Cozinha montada área de serviço separada água quente,Comum,1,
495,16,"Estrada Campo Novo, Ipanema",,,,,1,100,Excelente área para investidores com 2 394 m² sendo 20m de frente Localizado a uma quadra da Avenida Juca Batista com transportes e infra do bairro completa Para mais informações,Destaque,1,1800000
496,17,"Avenida Farrapos, São Geraldo",,,,,220,60,Excelente localização São aproximadamente 88m² 3 dormitórios 1 banheiro sala para 2 ambientes sala de jantar cozinha área de serviço sacada panorâmica toda envidraçada U,Comum,1,150000
497,18,"Rua Corrêa Lima, Santa Tereza",,,,,700,2000,Crédito real vende Maravilhosa vista para o Rio Guaíba pôr do sol Apartamento de 3 dormitórios com 102 metros privativos sendo suíte e banheiro social lavabo living amplo,Destaque,1,1524474
498,19,"Avenida Edgar Píres de Castro, Belém Novo",,,,,1,900,Excelente terreno plano com 3 hectares ótimo para construção de condomínio loteamento No mesmo estão construídas 2 casas de 2 e 3 dormitórios garagem para 4 carros plantação a,Destaque,1,1400000
499,20,"Cavalhada, Porto Alegre",,,,,426,90,Apartamento de 3 dormitório s 1 suíte s e 1 vaga s de garagem para VENDA na da Cavalhada nº 4530 no bairro Cavalhada em Porto Alegre Kotel Imobiliária oferta para VENDA Apa,Comum,1,
500,21,"Rua Carumbé, Alto Petrópolis",,,,,,,Super promoção para o mês de janeiro Apto 2 dorms com excelente dimensionamento dos ambientes Suite com muito espaço para armários social 2 ambientes com janela panorâmica co,Comum,1,271542
501,22,"Avenida Protásio Alves, Petrópolis",,,,,414,1,Crédito Real Moinhos vende sala comercial semi mobiliada em ótima localização próximo ao Colégio Santa Inés Barão do Amazonas desocupada bem iluminada e bem ventilada 1 banh,Destaque,1,230860
502,23,"Rua Vidal de Negreiros, Partenon",,,,,,,Apartamento 2 dormitórios com PÁTIO à poucos metros da PUCRS Em ótima localização pertinho da Puc e Av Bento Gonçalves com sol da manhã REFORMADO e DESOCUPADO Totalmente refo,Comum,1,
503,24,"Avenida Dom Cláudio José Gonçalves Ponce de Leão, Vila Ipiranga",,,,,390,380,NBKT NOBILITARE oferta para VENDA Apartamento no bairro Vila Ipiranga em Porto Alegre com 3 dormitório s 1 vaga s de garagem com área privativa de 66 00 m² e área total d,Comum,1,395000
504,1,"Area Rural de Porto Velho, Porto Velho",,,,,,,Sitio a venda 12 km do município de Porto Velho RO com área total de 33 hectares contendo 02 casas tanque de peixe e energia Documentação Escritura Pública,Super destaque,1,580000
505,2,"Rua Brasilândia, Nacional",,,,,,434,O que nos levou a deixar este valor foi por varias coisas agregadas ao imóvel Na frente do imóvel tem uma edificação com toda estrutura metálica com 100 m ² de laje construída co,Super destaque,1,850000
506,3,"Rua Estela, Cuniã",,,,,,,Apartamento à venda No bairro Cuniã Residencial Stella Apartamentos novos 65m² de área privativa 2 quartos sendo 1 suíte banheiro social sala ampla cozinha área de,Super destaque,1,195000
507,4,"Avenida Prefeito Chiquilito Erse, Industrial",,,,,530,,Apartamento disponível para venda o Águas do Madeira encanta pela qualidade do acabamento e boa distribuição interna Os 75m² são divididos em uma ampla sala 02 ambientes cozinh,Destaque,1,380000
508,5,"Triângulo, Porto Velho",,,,,400,,Terreno localizado em um residencial busca conforto e qualidade de vida para seus moradores São 450 m² apto para construir a casa dos seus sonhos Terreno na quadra mais alta,Destaque,1,185000
509,6,"Eletronorte, Porto Velho",,,,,,,Linda chácara próximo a UNIR PORTO VELHO com área de 10 000m² bem cuidada contendo 1 casa principal com suíte sala integrada e varanda Mais 2 suítes separadas Casa para caseiro,Destaque,1,265000
510,7,"Rua Piau, Lagoinha",,,,,,,Sobrado lindo com fino acabamento com 3 quartos sendo 1 suíte c closet 2 semi suítes Area externa com churrasqueira Parte inferior lavabo sala estar jantar e cozinha concei,Comum,1,395000
511,8,"Rodovia BR-364, Cidade Jardim",,,,,,,Vendo um excelente terreno nas primeiras ruas do condomínio Alphaville br está localizado no bairro Cidade Jardim tem 411 metros quadrados Maiores informações falar com a Corretor,Comum,1,240000
512,9,"Eletronorte, Porto Velho",,,,,,,Ótima casa bem localizada no bairro Eletronorte área total do terreno 250m² casa bem construída de aproximadamente 130m² Contém 01 suíte com closet e jardim de inverno,Destaque,1,300000
513,10,"Rua Jardins, Bairro Novo",,,,,,,Excelente casa Condomínio Girassol Sala dois ambientes 2 quartos Cozinha Ampliada Varanda em alvenaria Quintal Amplo Portas janelas e box em blindex bancada e pia em márm,Comum,1,240000
514,11,"Rua Maringá, Ulisses Guimarães",,,,,,300,Excelente Casa no Marcos Freire contendo 03 quartos sendo um suíte sala ampla WC social cozinha área de serviço quintal 02 vagas de garagem documentada murada e portão ele,Comum,1,100000
515,12,"Rua Guiana, Embratel",,,,,,,Casa no bairro Embratel próximo ao shopping Casa pronta para você morar próximo a PVH shopping Colégios Praças de Alimentação Parque da Cidade Farmácia Academias,Comum,1,620000
516,13,"Rua Coimbra, Flodoaldo Pontes Pinto",,,,,,,Casa Pronta Bem localizada no Flodoaldo 4 Quartos 3 suítes 1 delas adaptada para cadeirante Ampla medindo 204 m de área útil Sala estar e jantar Cozinha a,Destaque,1,385000
517,14,"Avenida Campos Sales, Areal",,,,,,,Vendo casa bem ampla com sala de estar jantar cozinha 3 qts sendo 1 suíte a casa é alta a garagem fica no sóton embaixo e a casa fica na parte de cima tem piscina churra,Comum,1,500000
518,15,"Cuniã, Porto Velho",,,,,,,CASA ACONHEGANTE PARA FAMÍLIA Já idealizou uma casa com conforto requintes de conforto comodidade e com excelente localização Pois nós encontramos a melhor solução para você,Comum,1,373000
519,16,"Rua Buenos Aires, Nova Porto Velho",,,,,600,600,Ótima casa no Bairro Nova Porto Velho com 300 metros quadrados com 3 quartos sendo 2 suítes e 3 banheiros sala cozinha área de serviço garagem para 2 carros espaço com churras,Destaque,1,450000
520,17,"Tiradentes, Porto Velho",,,,,,,Terreno ótimo metragem maravilhosa 448mts 12 x 37 37m conforme escritura Murado com idéia iniciada para construção de 02 casas geminadas Diferencial Localização privilegi,Comum,1,167895
521,18,"Avenida Farquar, Centro",,,,,,,imóvel residencial estilo cobertura em no residencial Sol nascente próximo ao CPA no bairro pedrinhas localizado na região central de Porto velho residencia com 3 dormitórios s,Comum,1,780000
522,19,"Rua Curitiba, Caladinho",,,,,,,Casa de 3 Quartos sendo uma suíte localizada na rua Curitiba bairro Caladinho conjunto Tucuruí Possui garagem para 3 a 4 carros varanda na frente e atraz Terreno 10 X30 com ca,Destaque,1,250000
523,20,"Flodoaldo Pontes Pinto, Porto Velho",,,,,,,Este te lote é perfeito para você que pretende investir ou até mesmo construir a casa dos seus sonhos Localizado no Residencial GreenVille um loteamento com excelente infraest,Comum,1,120000
524,21,"Mariana, Porto Velho",,,,,,,Casa no bairro Mariana com área total 250 m² área construída 127 m² contendo 2 quartos sendo uma suite sala cozinha lavanderia e área de serviço Garagem coberta Financi,Comum,1,110000
525,22,"Rua Anari, Floresta",,,,,,,Apartamento no bairro Floresta com 70 metros quadrados com 3 quartos sendo 1 suíte e banheiro social Sala com sacada cozinha com área de serviço conjugada Gás encanado Duas vag,Destaque,1,310000
526,23,"Rio Madeira, Porto Velho",,,,,532,,Conforto qualidade aconchego ambiente agradável Essas são algumas de muitas qualidades deste apartamento localizado no Mont Ville São 76m² dividido em 03 domritórios s,Comum,1,330000
527,24,"Rua Noroeste, Castanheira",,,,,,,imóvel residencial na zona sul de porto com 2 dormitórios sendo 1 suíte sala cozinha área de serviço escritório área total 10x70 residência com 100 de área construída valo,Comum,1,107000
528,1,"Avenida Minas Gerais, Paraviana",,,,,,,Vende se terreno no Cidade Satélite Tamanho 12x30Rua asfaltada DocumentadoNão apto a financiamentoValor 95mil Contato,Super destaque,1,95000
529,2,"Avenida Antonino Menezes da Silva, Caçari",,,,,,,CID ESCRITÓRIO IMOBILIÁRIO CRECI 4339 18ª REGIÃO AM RR PF Vende mansão luxuosa no bairro caçari com todos os moveis e os já projetados 04 quatro suítes no térreo 3 suítes,Super destaque,1,1900000
530,3,"Avenida Capitão Júlio Bezerra, Centro",,,,,,,,Super destaque,1,2100000
531,4,"Caranã, Boa Vista",,,,,,,Oportunidade casa no Caranã casa com 3 quartos sendo três suites área de serviço bem espaçosa canil duas salas integradas e com valor super acessivel,Destaque,1,320000
532,5,"Murilo Teixeira Cidade, Boa Vista",,,,,,,loteamento Caburai 01 dois lotes lado a lado excelente oportunidadeagende sua visita,Comum,1,80000
533,6,"Avenida Nazaré Filgueiras, Doutor Silvio Botelho",,,,,,,Vende se casa no Bairro Silvio Botelho bem localizada próximo a comércios escolas e ao Hospital das Clínicas 02 quartos 02 wc social Sala cozinha área de serviço Acabament,Comum,1,350000
534,7,"Rua Luiza Malaquias, Paraviana",,,,,,,Vende se terreno bem localizado no início do mecejana 50x 50 no total de 04 lotes Valor 1 2 Aceitamos proposta,Destaque,1,1200000
535,8,"Avenida General Ataíde Teive, Mecejana",,,,,,,Um investimento seguro Vende se imóvel localizado no Bairro Mecejana com duas casas sendo Casa 01 01 suíte 01 quarto sala sala de jantar cozinha wc social área de serv,Destaque,1,395000
536,9,"Rua Félix Valois de Araújo, Uniao",,,,,,,Ótima casa pra venda contendo 3 dormitórios sendo 2 suítes 3 vagas de garagens 3 salas visita de estar e outra de jantar Cozinha planejada Lavanderia WC social Varanda Po,Comum,1,320000
537,10,"Rua Ivone Pinheiro, Tancredo Neves",,,,,,,CID ESCRITÓRIO IMOBILIÁRIO CRECI 4339 18ª REGIÃO AM RR PF VENDE IMÓVEL COMERCIAL RESIDENCIAL COM UM PONTO COMERCIAL PELA AVENIDA NOSSA SENHORA DE NAZARÉ PRÓXIMO AO ESTÁDIO RI,Comum,1,550000
538,11,"Rua Vereador Waldemar Gomes, Pintolândia",,,,,,,Ótima residência composta de 3 quartos sendo 2 suítes sendo a master com closet sala cozinha ampla wc social lavanderia área gourmet revestidos no porcelanato toda casa fo,Comum,1,275000
539,12,"Rua José Alber Sampaio, Pintolândia",,,,,,,Vende se casa com ponto comercial com título definitivo Contendo salão de refeição duas salas duas cozinhas 02 quartos e 01 suíte wc social Uma edícula nos fundos com duas su,Comum,1,295000
540,13,"Rua Dona Marina Carneiro, Cinturao Verde",,,,,,,Realize o sonho de morar bem Vende se excelente casa com 03 quartos sendo 01 suíte sala de estar sala de jantar cozinha americana wc social área de serviço e garagem cob,Destaque,1,450000
541,14,"Área Rural, Area Rural de Boa Vista",,,,,,,Vendo Área Rural Tamanho 62 hectares Município de Boa Vista Lavrado Alto Topografia excelente Potencial de Plantio de 58 Hectares para soja milho bananas macaxeira e demais Reg,Comum,1,620000
542,15,"Rua 01, Cidade Satelite",,,,,,,Ferreira Neto EmpreendimentosCRECI 564 J,Comum,1,155000
543,16,"Alameda Júpiter, Nossa Senhora Aparecida",,,,,,,Vende se casa nova dois pisos 03 suítes uma delas com closet e varanda Sala de estar e jantar Cozinha com ilha Área gourmet Área de serviço Wc social Depósito Piscina Ga,Comum,1,1090000
544,17,"Rua Grão-Mestre Ademir Viana, Santa Luzia",,,,,,,Linda casa situada a Rua Grã Mestre Aldemir Viana 1770 Santa Luzia Contendo 3 suítes 2 salas cozinha americana área de serviço garagem para 3 carros varanda e portão eletrôn,Comum,1,240000
545,18,"Área Rural, Area Rural de Boa Vista",,,,,,,Carta de Crédito para Imóveis ou áreas rurais Créditos a partir de 200 mil até 20 milhões Taxa a partir de 1 5 anual Sem burocracia Compre seu imóvel Chácara Sítio Terra,Comum,1,500000
546,19,"Rua OP-V, Operario",,,,,,,Vende um terreno localizado na Rua Op Bairro Operário Medindo aproximadamente 250m² de área total AB Escritório Imobiliário CRECI AM RR 18 005 042 Av Getúlio Vargas 5485,Comum,1,60000
