,Posição,Endereço,Área,Quartos,Banheiros,Vagas,Condomínio,IPTU,Descrição,Status,Página,Preço
222,7,"Avenida Brasil, Chacara Brasil",,,,,,,9 8 9 8 8 1 4 1 4 1 4 Boate com área total 10 X 30 Ótima localização bairro Chácara Brasil Casa duplex com espaço coberto caixa piscina boate 3 q,Comum,1,190000
223,8,"Avenida Daniel de La Touche, Cohama",,,,,,,Contato 9 8 8 8 1 4 1 4 1 4 Apartamento 3 quartos Uma suíte Cozinha projetado Todo no porcelanato Suíte projetada Sala com painel projetado em porcelanato S,Comum,1,220000
224,9,"Rua Adelino Teixeira, Cohama",,,,,,,O apartamento está localizado no bairro Cohama com 45 metros quadrados com 2 quartos e 1 banheiro Possui academia espaço gourmet área verde de jardim playground espaço para fes,Comum,1,220000
225,10,"Conjunto Primavera, Residencial Sao Domingos",,,,,,800,A casa no bairro Turu possui 120 metros quadrados com 4 quartos sendo 2 suites e 3 banheiros Possui espaço gourmet salão para festas e eventos Vai lhe possibilitar curtir os dias,Comum,1,450000
226,11,"Rua do Pau D'Arco, Pirapora",,,,,,,A casa de vila sobrado no bairro Pirapora tem 200 metros quadrados com 3 quartos sendo 1 suite e 1 banheiro localização excelente proximo do mateus do anil faculdades rodoviar,Comum,1,135000
227,12,"Conjunto Primavera, Turu",,,,,,,O apartamento no bairro Turu tem 55 metros quadrados com 2 quartos sendo 1 suite e 2 banheiros Possui área de fitness espaço gourmet área verde de jardim playground salão para,Comum,1,210000
228,13,"Avenida Deputado Luís Eduardo Magalhães, Calhau",,,,,,,O apartamento está localizado no bairro Calhau possui 65 metros quadrados com 2 quartos sendo 1 suite e 2 banheiros Possui área de fitness espaço gourmet jardim parquinho infant,Comum,1,420000
229,14,"IPEM Turu, São Luís",,,,,,,PASSO Fit Vivare 2 no Turu 4 andar nascente com elevador sala varanda cozinha americana área de serviços banheiro social dois quartos sendo uma suíte Área de lazer complet,Comum,1,110000
230,15,"Rua Comodoro, Vila Isabel Cafeteira",,,,,,,A casa de vila sobrado está localizado no bairro Vila Isabel Cafeteira possui 127 metros quadrados com 3 quartos sendo 1 suite e 1 banheiro,Comum,1,58000
231,16,"Avenida Neiva Moreira, Calhau",,,,,,,O apartamento está localizado no bairro Calhau possui 86 metros quadrados com 3 quartos sendo 1 suite e 3 banheiros Possui espaço gourmet lareira área de recreação infantil acad,Comum,1,520000
232,17,"Rua A, Cohatrac I",,,,,,900,A casa está localizado no bairro Cohatrac I com 130 metros quadrados com 3 quartos sendo 1 suite e 3 banheiros Vai lhe possibilitar todo o conforto do ar condicionado nos dias mais,Comum,1,360000
233,18,"Turu, São Luís",,,,,,,PASSO Gran vilage Brasil 2 térreo nascente sala varanda cozinha americana área de serviços banheiro social dois quartos sendo uma suíte Área de lazer completa vaga de gara,Comum,1,78000
234,19,"Jardim Eldorado, São Luís",,,,,550,,A casa de condomínio no bairro Jardim Eldorado possui 110 metros quadrados com 3 quartos sendo 1 suite e 2 banheirosFica em um condomínio fechado,Comum,1,450000
235,20,"Alto do Calhau, São Luís",,,,,,,Ú N I C O VILLAGE PRIME CALHAU Na escolha de um empreendimento o que realmente importa Apenas Localização Ou Localização e itens que realmente agreguem na QUALIDADE DE V,Comum,1,299006
236,21,"Rua D, Planalto Anil II",,,,,,,Ótima Casa no Planalto Anil 2 3 quartos sendo um com suíte 1 banheiro social Sala Copa Cozinha Garagem pra 2 carros Valor 280 Mil Aceita Financiamento Contatos ZAP,Comum,1,280000
237,22,"Calhau, São Luís",,,,,,,O apartamento no bairro Calhau tem 86 metros quadrados com 3 quartos sendo 1 suite e 2 banheirosFica em um condomínio fechado Elevador para mais praticidade no dia a dia,Comum,1,500000
238,23,"Avenida João Pessoa, João Paulo",,,,,,,O apartamento está localizado no bairro João Paulo possui 56 metros quadrados com 2 quartos sendo 1 suite e 2 banheiros Possui academia espaço gourmet área de brinquedo para as c,Comum,1,253900
239,24,"Rua General Artur Carvalho, Turu",,,,,,,ATENDIMENTO IMEDIATO VIA WHATSAPP 9 8 9 8 8 2 4 8 3 8 1 CRECI 6493 Dagno Pinheiro O QUINTAS DO TURU é um empreendimento da construtora CONCEITO localizado no TURU logo após o M,Comum,1,269254
240,1,"Rua Tenente-Coronel Thogo da Silva Pereira, Goiabeiras",,,,,,,Elegância sofisticação identidade e contemporaneidade Tudo isso reunido em um empreendimento único no coração de Cuiabá Apartamentos de 2 e 3 quartos entre 57 m² e 78 m² se,Em construção,1,427800
241,2,"Rua Tenente-Coronel Thogo da Silva Pereira, Goiabeiras",,,,,,,Elegância sofisticação identidade e contemporaneidade Tudo isso reunido em um empreendimento único no coração de Cuiabá Apartamentos de 2 e 3 quartos entre 57 m² e 78 m² se,Em construção,1,568800
242,3,"Avenida Ipiranga, Porto",,,,,,,Apartamentos de 2 quartos no Porto em condomínio fechado com elevador todos com vaga de garagem Segurança tranquilidade conforto e área de lazer para a diversão da sua família,Em construção,1,217990
243,4,"Rua Júlio Domingos de Campos, Centro Político Administrativo",,,,,,,LOTE GRANDE DE ESQUINA BEM LOCALIZADO Terreno em condomínio em Cuiabá Referência 0015 Nome do empreendimento CONDOMÍNIO HORIZONTAL FLORAIS DOS LAGOS,Super destaque,1,990000
244,5,"Avenida Érico Gonçalves Preza Filho, Jardim Itália",,,,,,,Vendo casa nova térrea no Condomínio Alphaville 2 em Cuiabá MT Área construída 230m² Área de terreno 430m² Sala ampla com pé diretor duplo com porta de correr da marca Cl,Super destaque,1,2150000
245,6,"Rua Estevão de Mendonça, Quilombo",,,,,900,,Apartamento 3 Suítes sendo 1 Máster 193 m² Edifício Sofisticato Bairro Quilombo Cuiabá MT Apartamento de 193 m² privativos 03 Suítes sendo 1 Máster Sala de Tv S,Super destaque,1,1900000
246,7,"Avenida Doutor Hélio Ribeiro, Residencial Paiaguas",,,,,,,UPPER PARQUE DAS ÁGUAS Apto com 78m² sendo 3 quartos com 1 suíte Repleto de móveis Planejados e ar 2 vagas garagem 5º andar Cozinha com planejado fogão e coifa máquina la,Destaque,1,140000
247,8,"Rua Marechal Floriano Peixoto, Duque de Caxias",,,,,780,1700,2 quartos sendo uma suíte Cozinha mobiliada lavanderia sala de jantar sala de TV Banheiro social área de serviços sacada com churrasqueira a gás 2 Garagens cobertas Inf,Comum,1,500000
248,9,"Avenida A, Terra Nova",,,,,450,,Venda Apartamento Porteira Fechada Cond Alvorada Cuiabá MT Apartamento Condomínio Alvorada Cuiabá MT Todo Mobiliado Porteira Fechada Pronto para Morar sem necessidade de re,Super destaque,1,510000
249,10,"Santa Cruz II, Cuiabá",,,,,,,Casa a venda no Jd Santa Cruz II Cuiabá Terreno com 300m2 Área construída 100m2 Três quartos sendo 1 suíte Banheiro social Sala de estar e jantar Cozinha Lavand,Destaque,1,430000
250,11,"Avenida Governador Dante Martins de Oliveira, Carumbé",,,,,,,O apartamento no bairro Carumbé tem 71 metros quadrados com 3 quartos sendo 1 suite e 2 banheiros Possui academia espaço gourmet espaço jardinado parquinho infantil salão para,Comum,1,340000
251,12,"Rua Doutor Santo Scaravelli, Despraiado",,,,,580,,Com tudo que temos vivido nos últimos tempos ter um espaço se tornou o desejo de todos nós não é mesmo E esse apartamento surpreendeu o Alessandro por ser bem completo Conta c,Comum,1,480000
252,13,"Rua Alísios, Despraiado",,,,,618,,O apartamento mobiliado está localizado no bairro Despraiado conta com 84 metros quadrados com 3 quartos sendo 1 suíte e 2 banheiros sala cozinha área de serviço sacada e 2 v,Comum,1,440000
253,14,"Rua R, Areão",,,,,795,2200,Andar alto Sala para dois ambientes Sacada com churrasqueira Cortina de vidro Cozinha Área de serviço Lavabo Banheiro social 3 quartos sendo 1 suíte 03 vagas de garagem,Comum,1,780000
254,15,"Rua Oriente Tenuta, Alvorada",,,,,630,,O apartamento no bairro Alvorada possui 97 metros quadrados com 3 quartos sendo 1 suite e 1 banheiro Possui área de fitness espaço gourmet espaço jardinado parquinho infantil s,Comum,1,580000
255,16,"Rua Professor João Pedro Gardés, Jardim Aclimação",,,,,600,,O apartamento está localizado no bairro Jardim Aclimação com 116 metros quadrados com 2 quartos sendo 1 suite e 3 banheiros sala ampliada porcelanato Possui área de fitness es,Comum,1,550000
256,17,"Avenida Doutor Hélio Ribeiro, Residencial Paiaguas",,,,,420,1350,UPPER Apto com 78m2 sendo 3 quartos com 1 suíte Repleto de móveis Planejados e ar 2 vagas garagem 5º andar Cozinha com planejado fogão e coifa máquina lavar Valor 549 00,Comum,1,549000
257,18,"Avenida Archimedes Pereira Lima, Jardim das Américas",,,,,470,,O que é importante em um imóvel para você Privacidade localização luminosidade Se estas forem as características do imóvel que você procura então te convido a conhecer este,Comum,1,460000
258,19,"Rua Atenas, Despraiado",,,,,500,,Residencial Good Green Localizado a 4km do Parque das Águas Centro Politico Administrativo 500mts da Av Miguel Sutil Vendido PORTEIRA FECHADA Tirando apenas as coisas,Destaque,1,450000
259,20,"Coophema, Cuiabá",,,,,395,,Apartamento no condomínio Spazio Cristalli localiza se no segundo andar um lance de escada sol da manhã de fácil acesso pois fica no primeiro bloco a esquerda após a entrada d,Destaque,1,168000
260,21,"Avenida Antártica, Santa Rosa",,,,,900,,Apartamento completo de armários e com alguma mobília possui churrasqueira na sacada próximo aos shoppings Goiabeiras e Estação O apartamento no bairro Santa Rosa com 140 metros,Comum,1,830000
261,22,"Avenida Angola, Santa Rosa",,,,,980,,O apartamento Andar alto Sol da manhã Sacada com churrasqueira Sala para 2 ambientes Lavabo Cozinha Área de Serviço com banheiro 3 suítes completas de armários 2 vagas gara,Comum,1,820000
262,23,"Rua Professora Neuza Lula Rodrigues, Barra do Pari",,,,,800,1200,O sobrado no bairro Barra do Pari tem 218 metros quadrados com 3 quartos sendo 2 suites e 4 banheiros Possui varanda móveis planejados em todos os cômodos ar condicionado nos qua,Destaque,1,450000
263,24,"Avenida Manoel José de Arruda, Grande Terceiro",,,,,550,,Apartamento disponível no Residencial Parque Beira rio Todo Mobiliado contendo 3 quartos sendo 1 suíte sala de estar jantar cozinha banheiro social lavanderia e 2 vagas na g,Comum,1,490000
264,1,"Rua Onze de Outubro, Vila Planalto",,,,,,,Um lugar aconchegante e que surpreende Um refúgio por dentro e muito lazer por fora Um lugar que vai elevar o seu patamar de morar bem Conheça o Jooy Wonder o segundo lançament,Na planta,1,339990
265,2,"Rua Franklin Roosevelt, Centro",,,,,,,O Vista é um empreendimento único em Campo Grande Ele une o luxo a exclusividade e o conforto de viver em um dos bairros mais nobres da cidade o Jardim dos Estados Você pode e,Em construção,1,412000
266,3,"Rua Petrópolis, Parque Residencial dos Girassóis",,,,,,,Piso Laminado na Sala Piso Laminado no Quarto Lazer equipado Previsão para medição de água individualizada Sistema de segurança ECO Preparação para Wi fi nas áreas de lazer P,Em construção,1,173990
267,4,"Rua Mercedes P. Mayer, Jardim Samambaia",,,,,,2000,Casa Térrea na Região do Pedrossian saída p três lagoas Imóvel amplo Possui armários planejados área de churrasqueira e bom quintal Sala de Estar Sala de Jantar 3 Dor,Super destaque,1,490000
268,5,"Vila São Jorge da Lagoa , Campo Grande",,,,,,,Seu sossego esta aqui Imagine você morar nessa casa dentro desse lindo condomínio com segurança 24horas Você gostaria Um lugar onde você não vai se preocupar em fazer muros,Super destaque,1,215000
269,6,"Jardim São Lourenço, Campo Grande",,,,,,,Casa top 03 quartos Jd São Lourenço Campo Grande MS Brasil CHÃO DO BRASIL IMÓVEIS Campo Cidade vende IMÓVEL RESIDENCIAL URBANO USADO CASA TÉRREA no Jardim São Lourenço,Super destaque,1,550000
270,7,"Rua Clorita, Coopharadio",,,,,,,A casa térrea está localizada no bairro Coopharádio com 360 metros quadrados cozinha grande com armários sala com dois ambientes escritório 4 quartos e 3 banheiros Piso em taco,Destaque,1,350000
271,8,"Rua Corumbatai, Jardim do Corrego",,,,,,,Código na caixa 08444421661861 2 quartos 1 Vaga na Garagem varanda área de serviço WC sala cozinha COND RES CORUMBAI DO LAJEADO CAMPO GRANDE JARDIM DO CORREGO Imóve,Comum,1,89090
272,9,"Rua Oriomar Fernandes, Vila Moreninha IV",,,,,,,Código na caixa 08444413814760 2 quartos 1 Vaga na Garagem área de serviço WC sala cozinha CONDOMINIO RESIDENCIAL ORIOMAR FERNANDES CAMPO GRANDE VILA MORENINHA IV Im,Comum,1,71491
273,10,"Rua Ângela Abdulahad, Jardim Paradiso",,,,,,,Apartamento semi mobiliado com armários cama geladeira fogão sofá painel para TV 2 quartos 1 banheiro cozinha com área de serviço conjugada e sala ampla 1 vaga de garagem,Destaque,1,140000
274,11,"Rua Maria de Lourdes Vieira Matos, Varandas do Campo",,,,,,,Código na caixa 08555521756777 2 quartos 1 Vaga na Garagem área de serviço WC sala cozinha Cond Res das Aguas Imóvel NÃO aceita utilização de FGTS Imóvel aceita con,Comum,1,52371
275,12,"Nova Lima, Campo Grande",,,,,,,Excelente imóvel no bairro Nova Lima com 150m2 de área construída e 360m2 de área total ideal para comércio ou residência atualmente funciona uma conveniência com ótimos rendimen,Destaque,1,250000
276,13,"Bairro Seminario, Campo Grande",,,,,,,Belíssima casa térrea no Jardim Seminario 240 m² de área total 140 m² de área construída 3 quartos sendo 1 suíte WC social Cozinha com bancada de mármore em L com,Comum,1,600000
277,14,"Rua Luís de Albuquerque, Sobrinho",,,,,,,VENDO SOBRADO REFORMADO VILA SOBRINHO Sala de estar Cozinha 1 Suite 2 Quarto Banheiro social Área de lazer Churrasqueira EXCELENTE LOCALIZAÇÃO A 2 KM DO CENTRO,Comum,1,300000
278,15,"Rua Ataulfo Paiva, Jardim Noroeste",,,,,,,Terreno 12x30 com 4 peças e 2 banheiros todo murado,Comum,1,60000
279,16,"Rua São Gilberto, Jardim Seminário",,,,,,1090,Casa super gostosa contendo 1 suíte 2 quartos banheiro social Sala cozinha Grande Quintal gramado Garagem para 2 carros 1 vaga coberta e 1 descoberta Portão de elevação Ce,Comum,1,
280,17,"Rivieira Pak, Campo Grande",,,,,,,Terreno de 420 metros quadrados 12 metros quadrados de frente 35 metros quadrados de fundo localizado no Bairro Riviera Park Campo Grande Campo Grande MS Venda por tran,Comum,1,50000
281,18,"Jardim Tijuca, Campo Grande",,,,,,,SOBRADO ACOCHEGANTE DESCRIÇÃO DO IMÓVEL Aceita financiamento Aceita permuta Água Asfalto Linha de Onibus Calçada Muro Cerca elétrica 1 Apto 2 Quarto s Sacada 1 Varand,Destaque,1,600000
282,19,"Conjunto Residencial Estrela do Sul , Campo Grande",,,,,,,CASA NO CORONEL ANTONINO COM DESIGNE MODERNA ÁREA GOURMET COM CHURRASQUEIRA E AMPLO QUINTAL 3 Quartos sendo 1 Suíte Sala ampla com Pé direito de 4m Projeto Luminotécnico Jan,Destaque,1,
283,20,"Rua Vicente Pinzon, Vila Planalto",,,,,,,Casa antiga 70 m Terreno de 360 m Com 3 quartos sala cozinha wc área de serviço quintal varanda espaço para varios carros Fundos Edicula com 3 peças wc varanda Locali,Destaque,1,310000
284,21,"Rua Nilo Javari Barem, Vila Serradinho",,,,,,,CASAS NO SERRADINHO Excelente localização Avaliação186 mil Venda 179 mil Há 300m do BAVEx 53 50 m2 AC 90m2 AT 1 suíte 1 quarto Sala Cozinha Banheiro social área de sv e,Destaque,1,179000
285,22,"Rua Maria de Lourdes Vieira Matos, Varandas do Campo",,,,,,,Código na caixa 08555522204018 2 quartos 1 Vaga na Garagem área de serviço WC sala cozinha Cond Res das Aguas Imóvel NÃO aceita utilização de FGTS Imóvel aceita con,Comum,1,54129
286,23,"Rua Pedro Celestino, Centro",,,,,,2500,Salão com terreno em ótima localização comercial incluindo duas pequenas casas no fundo de pequena metragem usado para deposito materiais São 3 inscrições municipais individuais,Comum,1,450000
287,24,"Rua Rio Negro, Vila Margarida",,,,,,,Apartamento Vitalita 88 m Rico em armários embutidos documentação ok 1 suite e 2 demo suites Alugado por R 2 500 00 16 andar Nascente Oportunidade de negócio Maiores info,Destaque,1,600000
288,1,"Rua Espírito Santo, Centro",,,,,,,O Metropolis é um empreendimento exclusivo para quem merece viver bem Com localização privilegiada na região Centro sul de Belo Horizonte você ficará a poucos minutos da Praça d,Em construção,1,480000
289,2,"Rua Araguari, Barro Preto",,,,,,,Pré Lançamento Residencial exclusivo no Barro Preto Com fácil acesso as Av do Contorno Av Amazonas e Av Bias Fortes e um amplo mix de comércio e serviços 01 e 02 Quartos co,Em construção,1,358000
290,3,"Rua Alagoas, Funcionários",,,,,,,Plantas com espaços integrados e suítes em todos os quartos Recuo do empreendimento através da Praça que será construída na frente que vai trazer mais iluminação segurança movi,Na planta,1,
291,4,"Lourdes, Belo Horizonte",,,,,2500,,Cobertura Top House com 444 m² ampla sala de estar para vários ambientes com varanda gourmet com churrasqueira piscina aquecida e projeto paisagístico São 4 quartos sendo 1 s,Super destaque,1,5900000
292,5,"Rua Alcobaça, São Francisco",,,,,450,1178,Excelente cobertura com churrasqueira vista definitiva próximo a comércio e a mata preservada do Exército 01º pavimento 01 sala 03 quartos 01 banheiro com armário e box,Super destaque,1,330000
293,6,"Rua Pirite, Santa Tereza",,,,,,516,Casa de 275 87 m² construídos em uma área de terreno de 400m² 03 pavimentos aquecimento solar e lazer 1º andar 01 sala para dois ambientes lavabo piso em porcelanato 02 suí,Super destaque,1,1800000
294,7,"Rua Aníbal Gontijo, Luxemburgo",,,,,400,3462,Apartamento 4 quartos Luxemburgo 2 salas com pisos tábua corrida 4 quartos com armários embutidos e pisos em madeira laminado sendo 1 suíte com armário sob bancada de mármor,Super destaque,1,650000
295,8,"Rua Garçom João Ferreira, Piratininga Venda Nova",,,,,,,Casa à Venda 1m² por R 250 000 Piratininga Venda Nova Belo Horizonte MG Encontrar o imóvel dos sonhos nunca foi tão fácil como na parceria entre a Arbo e a Imobiliária UNI,Comum,1,250000
296,9,"Rua Tenente Anastácio de Moura, Santa Efigênia",,,,,625,135,Ótimo apartamento com 2 quartos todos com armários planejado Sala para 2 ambientes Banho social armário e espelho Cozinha com armários Área de serviço com armário,Comum,1,360000
297,10,"Rua General Patton, Santa Amélia",,,,,,,Benefícios Excelente Casa Tríplex Nova localizada no bairro Santa Amélia Casa Linda Casa Triplex entrada independente dois pavimentos com aproximadamente 200 m² 1 P,Comum,1,699000
298,11,"Vila Clóris, Belo Horizonte",,,,,,,Excelente apartamento 03 quartos sendo 01 su te banho social sala ampla 02 ambientes cozinha ampla rea de servi o banho de empregada 02 vagas paralelas cobertas Alto padr o,Comum,1,350000
299,12,"Rua Menotti Muccelli, Camargos",,,,,,2500,Localização espetacular com excelente logística Galpão com 9 450 m² de área construída localizado no anel rodoviário de BH as margens logo após a Avenida Amazonas sentido Vit,Destaque,1,35000000
300,13,"Rua Artur Flávio, Rio Branco",,,,,,,Benefícios Excelente localização no bairro Rio Branco ótima localização Casa Linda Casa Geminada entrada independente dois pavimentos com aproximadamente 109 m² 1 Pav,Comum,1,499000
301,14,"Manacás, Belo Horizonte",,,,,,,Apartamento 02 quartos sendo 01 suíte banho social sala para dois ambientes cozinha americana área de serviço 02 vagas de garagem Elevador gás canalizado prédio 100 reves,Comum,1,345000
302,15,"Cenaculo, Belo Horizonte",,,,,285,,Apartamento SÉTIMO ANDARsala cozinha planejada banheiro 3 quartos 1 vaga de garagem condomínio localizado próximos a comércios supermercado bancos lojas linha do move na,Comum,1,250000
303,16,"Inconfidência, Belo Horizonte",,,,,,,Excelente apartamento no bairro Inconfidência Alípio de Melo ótima localização acabamento diferenciado e próximo ao comercio e linha de ônibus 2qts com suíte sala para dois am,Destaque,1,290000
304,17,"Rua Xapuri, Grajaú",,,,,800,4180,Apartamento 2 quartos Grajaú Prédio com área de lazer completa com piscina sauna academia espaço kids área gourmet e salão de festas Sala para dois ambientes com piso em,Destaque,1,670000
305,18,"Avenida Augusto de Lima, Barro Preto",,,,,235,,O Edifício Future Tower é um condomínio localizado na Avenida Augusto de Lima no bairro Barro Preto em Belo Horizonte MG O prédio possui elevadores modernos e rápidos Os pontos,Destaque,1,270000
306,19,"Rua Roma, Santa Lúcia",,,,,1547,517,Estacionamento Rotativo Operado atualmente pela Rede Rodo Park atende ao hospital Oncocentro e demais empresas sediadas no Complexo Paisagem Capacidade para 50 carros Coberto,Destaque,1,2750000
307,20,"Rua Alessandra Salum Cadar, Buritis",,,,,206,17,Valor Promocional Tabela R 219 500 00 por R 199 500 00 Prédio em boa localização em rua tranquila e de fácil acesso próximo ao parque Ageo Pio Sobrinho e ao super mercado Super N,Destaque,1,199500
308,21,"Rua Caetano Pirri, Milionários",,,,,,,Apartamento à Venda 46m² por R 215 000 Milionários Barreiro Belo Horizonte MG Encontrar o imóvel dos sonhos nunca foi tão fácil como na parceria entre a Arbo e a Laris imó,Comum,1,215000
309,22,"Estoril, Belo Horizonte",,,,,283,116,Sala à Venda 25m² por R 150 000 Estoril Belo Horizonte MG Encontrar o imóvel dos sonhos nunca foi tão fácil como na parceria entre a Arbo e a REALLE SOLUÇÕES IMOBILIÁRIAS IN,Comum,1,150000
310,23,"Rua Desembargador Fernando Bhering, Dona Clara",,,,,550,137,Ótimo apartamento com área privativa e excelente localização 03 quartos 01 suíte com varanda panorâmica e janelões em blindex armários embutidos em 02 dos quartos sala para,Comum,1,650000
311,24,"Caiçaras, Belo Horizonte",,,,,,,Vendo apartamento com área privativa 03 quartos sendo 01 com suite no bairro Caiçara em Belo Horizonte O apartamento com área privativa possui 03 quartos sendo 01 com suite sala,Comum,1,310000
312,1,"Travessa Quintino Bocaiúva, Batista Campos",,,,,,,Apartamentos 03 suítes com ampla sacada Últimas unidades O Residencial São Luís é localizado no privilegiado Bairro de Batista Campos um bairro dotado de excelente infraestrutu,Pronto para morar,1,875000
313,2,"Avenida Governador José Malcher, Nazaré",,,,,,,Salas comerciais a partir de 30m² Em pleno bairro de Nazaré Excelente localização no coração do nobre bairro de Nazaré na Av Governador José Malcher nº 1077 entre Dom Romual,Pronto para morar,1,215000
314,3,"Travessa Chaco, Marco",,,,,,,A Construtora Acrópole vem apresentar 9 grandes vantagens do seu mais novo lançamento em Belém do Pará O Residencial Foz do Iguaçu 1 Área de Lazer completa com Piscinas Play,Em construção,1,446600
315,4,"Avenida Pedro Miranda, Pedreira",,,,,,,O apartamento está localizado no bairro Pedreira tem 87 metros quadrados com 3 quartos sendo 2 suites e 3 banheiros Possui espaço gourmet espaço jardinado área de brinquedo para,Super destaque,1,680222
316,5,"Rodovia Augusto Montenegro, Parque Verde",,,,,,,Vendo casa no condomínio Cidade Jardim 1 Av Augusto Montenegro s N Cep Informações via whatsapp Clarisse Bacelar 91 9 8 4 1 9 2 0 2 0 WhatsApp Jessica Bacelar 91 9,Super destaque,1,890000
317,6,"Pedreira, Belém",,,,,,,CASA NA PEDREIRADISPONÍVEL PARA PARCELAMENTOENTRADA R 20000 PARCELASINTERESADOS FALAR 9 9 2 0 1 3 3 9 2 RAIANY ALEIXO ACEITAMOS FGTS COMO ENTRADA,Super destaque,1,120000
318,7,"Val de Caes, Belém",,,,,,,Ligação 9 8 4 3 4 2 2 0 5 Tratar com Fernando A vista ou parcelamento Use seu FGTS como Entrada parcelas de acordo com sua Entrada Entrada mínima 7 000 Mil A casa no bairr,Comum,1,100000
319,8,"Passagem Abelardo Conduru, Sacramenta",,,,,,,A casa no bairro Sacramenta possui 180 metros quadrados com 2 quartos sendo 1 suite e 2 banheiros venha adquirir seu imóvel através do crédito imobiliário aceito entrada no cartã,Comum,1,80000
320,9,"Rua Gaiapós, Condor",,,,,,,Contato NILSE9 8 3 5 6 3 4 0 9 casa no Bairro DA CONDOR com 3 quartos sendo 1 suites e 2 banheiros Possui garagem Vai lhe possibilitar aproveitar a vida ao ar livre no seu próprio,Comum,1,65000
321,10,"Jurunas, Belém",,,,,,,9 1 9 8 4 3 4 2 2 0 5 Tratar com FERNANDO A vista Use seu FGTS como Entrada Parcelamento de acordo com sua Entrada Crédito imobiliário Entrada a partir de R,Comum,1,120000
322,11,"Pedreira, Belém",,,,,,,Ctt 9 8 4 3 4 2 2 0 5 Use seu FGTS como Entrada Valor estipulado R 50 000 Entrada a partir R 7 000 mil Parcelas acima 500 R Parcelas de acordo com Entrada A casa no bair,Comum,1,50000
323,12,"Passagem Alberto Engelhard, Curió-utinga",,,,,,,Compre seu imóvel no curio utinga de forma parcelada Fazemos financiamento bancário e FGTS para entrada e parcelamos no boleto parcelamento e documentação para você não ter que s,Comum,1,75000
324,13,"Rua Santos Dumont, Brasilia Outeiro",,,,,,,A casa no bairro Brasília Outeiro tem 180 metros quadrados com 2 quartos e 2 banheiros saia do aluguel compre algo que é seu de forma segura aceito entrada no cartão saque FGTS,Comum,1,60000
325,14,"Rua Doutor Américo Santa Rosa, Canudos",,,,,,,Casa linda e aconchegante próximo a comércios com 2 quartos sendo uma suíte sala de jantar cozinha planejada banheiro e garagem A vista 85 mil ou entrada de 10 mil parcelas a,Comum,1,85000
326,15,"Rua Variante, Mosqueiro",,,,,,,Localizada em mosqueiro Casa com 4 4 sendo 2 suítes Banheiro social Piscina Área gourmet Garagem para 2carros Aceito FGTS como entrada Entrada Aparti de 10 000mil informa,Destaque,1,80000
327,16,"Avenida Ceará, Canudos",,,,,,,9 1 9 9 1 0 3 1 7 4 6 Rodrigo Garcez A casa no bairro Canudos tem 120 metros quadrados com 3 quartos sendo 1 suite e 1 banheiro Imóvel todo reformado ótima localização e períme,Comum,1,75000
328,17,"Alameda A, Marambaia",,,,,,,A casa no bairro Marambaia com 100 metros quadrados com 3 quartos sendo 1 suite e 2 banheiros Vende se Belo imóvel muito bem localizado Valor Total R 200 mil Entrada apartir d,Comum,1,20000
